{"metrics":{"deductionSteps":105,"maxDeductionDepth":13,"requiredGuessDepth":0,"searchNodes":0},"proofFormatVersion":1,"proofHash":{"profile":"STP-PROOF-JCS-1","sha256":"3f5311d78dcd10542620e1da615f5cdac1738400ad568a557c4311d623f69e1a"},"publicPuzzleHash":{"profile":"STP-PUZZLE-SEMANTIC-JCS-1","sha256":"2c60f24e5de6bf2f4c063ea9cdcbb09ff6dfa8299458a04e0d0fa71ac6e20254"},"puzzleId":"S1-04-02-03","solutionCount":1,"solutionHash":{"profile":"STP-SOLUTION-JCS-1","sha256":"c6f1fc499556eabb15727fc7aa667294a59d823a9933e2e07fc6e2ba780c7f71"},"solverVersion":"solver-v2"}