{"metrics":{"deductionSteps":105,"maxDeductionDepth":9,"requiredGuessDepth":0,"searchNodes":0},"proofFormatVersion":1,"proofHash":{"profile":"STP-PROOF-JCS-1","sha256":"1776e53395f857ef795a180ea4cb492e97abd34768e71217debb837996058ddb"},"publicPuzzleHash":{"profile":"STP-PUZZLE-SEMANTIC-JCS-1","sha256":"a2ff5ed6b2f48ec2f3bceb743b140fb224d1b87038b6233ed24bbe6eb1a827a8"},"puzzleId":"E1-9585f9981108dc1b3672a7e0f34eb6803a9445acbe0a60a0b7780de1a109c728","solutionCount":1,"solutionHash":{"profile":"STP-SOLUTION-JCS-1","sha256":"c446befea810b85fe2742156c6168e37509f684394c0e513a4a6c40d4650e990"},"solverVersion":"solver-v2"}