{"metrics":{"deductionSteps":66,"maxDeductionDepth":6,"requiredGuessDepth":0,"searchNodes":0},"proofFormatVersion":1,"proofHash":{"profile":"STP-PROOF-JCS-1","sha256":"f52ddbd4e2c7656e2b447401b80a3898b8b623efcb7ed376fe89fa8260329284"},"publicPuzzleHash":{"profile":"STP-PUZZLE-SEMANTIC-JCS-1","sha256":"72ee15ff46aa80e5adef4a1bc62195d0430b9d02115b64b3e64cb414aded5431"},"puzzleId":"E1-13e6bdbf4d5cce3afc6c96c7ec581e32b715c3b325597365f660c76899360888","solutionCount":1,"solutionHash":{"profile":"STP-SOLUTION-JCS-1","sha256":"6a5eb500c827ffc311eddf9e6ffa03ca9d0d425fbd6d10c13c7e1352a85c0de5"},"solverVersion":"solver-v2"}