{"metrics":{"deductionSteps":78,"maxDeductionDepth":10,"requiredGuessDepth":0,"searchNodes":0},"proofFormatVersion":1,"proofHash":{"profile":"STP-PROOF-JCS-1","sha256":"2fa9118c8cf6e525796798c3262da341a6a19de4f88cda0e08aaec823e9bd3d8"},"publicPuzzleHash":{"profile":"STP-PUZZLE-SEMANTIC-JCS-1","sha256":"dadcc9aa648e54479693cbe13692653f7321ebc289776977730caddf80f3b1f2"},"puzzleId":"E1-86fae50a73f89b5d64452ca1b244106e907d7948aa5175fab7eb61888087dfff","solutionCount":1,"solutionHash":{"profile":"STP-SOLUTION-JCS-1","sha256":"bf7e40fec8519f877e5e521673feeb79527ec475c0849a58d0dfbc0a36f2f606"},"solverVersion":"solver-v2"}