{"metrics":{"deductionSteps":231,"maxDeductionDepth":42,"requiredGuessDepth":0,"searchNodes":0},"proofFormatVersion":1,"proofHash":{"profile":"STP-PROOF-JCS-1","sha256":"53076d22a002812b77a19ab04a25e468fd01cae5011ac920acc9f231ecfe081c"},"publicPuzzleHash":{"profile":"STP-PUZZLE-SEMANTIC-JCS-1","sha256":"c72d1de5dd40cd021619a47269f2010a6a5cf0fa01738b0f5844bb71331a9b0e"},"puzzleId":"S1-05-04-11","solutionCount":1,"solutionHash":{"profile":"STP-SOLUTION-JCS-1","sha256":"aa49d8dd82020621b1e0ccdee2feabfdc468d91e0056a33fc4cb57fceb12557e"},"solverVersion":"solver-v2"}