{"metrics":{"deductionSteps":115,"maxDeductionDepth":12,"requiredGuessDepth":0,"searchNodes":0},"proofFormatVersion":1,"proofHash":{"profile":"STP-PROOF-JCS-1","sha256":"f6d4cbdb498c4e96ad06018956e947082a4b8890b9cfb2c4e99ddb4164d3afbe"},"publicPuzzleHash":{"profile":"STP-PUZZLE-SEMANTIC-JCS-1","sha256":"dbc049e8fb831a136158bf4e13f2975bc8f8afac4a225d87a7bdc88c383f3afd"},"puzzleId":"S1-04-01-06","solutionCount":1,"solutionHash":{"profile":"STP-SOLUTION-JCS-1","sha256":"33af7bbe5d1d7f581c5f687e69a310aa0359937afbb196f9e33966a9580282f4"},"solverVersion":"solver-v2"}