{"metrics":{"deductionSteps":75,"maxDeductionDepth":10,"requiredGuessDepth":0,"searchNodes":0},"proofFormatVersion":1,"proofHash":{"profile":"STP-PROOF-JCS-1","sha256":"9062dfac7822384fc6fad93015c318de3bb2c25bcbad3f198c1082b0f9d39503"},"publicPuzzleHash":{"profile":"STP-PUZZLE-SEMANTIC-JCS-1","sha256":"fae9fc3cd812b2e938a075f6cb1b68ba32b40f828afa83847f502aa0d0da8684"},"puzzleId":"E1-e35331c86bc852ac95f5b88dbcfce83db9937d4c71104742e431c3222dc7d938","solutionCount":1,"solutionHash":{"profile":"STP-SOLUTION-JCS-1","sha256":"efd6b78a6438d9f7420f3c6d7f132ca06fd856e29b5ac0d420afa144f122f5bd"},"solverVersion":"solver-v2"}