{"metrics":{"deductionSteps":100,"maxDeductionDepth":12,"requiredGuessDepth":0,"searchNodes":0},"proofFormatVersion":1,"proofHash":{"profile":"STP-PROOF-JCS-1","sha256":"ba6d4e48a4b6c96bc9cb42183d163a62c7a15bd7cadb62ab887d378ce3cffec1"},"publicPuzzleHash":{"profile":"STP-PUZZLE-SEMANTIC-JCS-1","sha256":"82081431b57581c5bcde4a7fe9919336aab6e1a9d8df0d862ecfbe4708e06253"},"puzzleId":"E1-54c72104ff7c446978ea4df0e3205071218262f9a0377e672f9e81caa38fc874","solutionCount":1,"solutionHash":{"profile":"STP-SOLUTION-JCS-1","sha256":"22f1b06219c5750ee8a02557c678ad6da2ea3c69ccb441c53620b7d77b9c00db"},"solverVersion":"solver-v2"}