{"metrics":{"deductionSteps":128,"maxDeductionDepth":13,"requiredGuessDepth":0,"searchNodes":0},"proofFormatVersion":1,"proofHash":{"profile":"STP-PROOF-JCS-1","sha256":"f3ef8a64cca6ac862ab788b023542d02f20f9900ab806fe72afe3fe0265bd7be"},"publicPuzzleHash":{"profile":"STP-PUZZLE-SEMANTIC-JCS-1","sha256":"465fdf72348a120a30824f7ddcf56c2668b4d4b746af3e7f3c0ae9ea7e26d1f7"},"puzzleId":"S1-05-01-07","solutionCount":1,"solutionHash":{"profile":"STP-SOLUTION-JCS-1","sha256":"6a460b37549960d9cb448701202d5b04ae11c849e3661c87d81153d5a686ec49"},"solverVersion":"solver-v2"}