{"metrics":{"deductionSteps":84,"maxDeductionDepth":16,"requiredGuessDepth":0,"searchNodes":0},"proofFormatVersion":1,"proofHash":{"profile":"STP-PROOF-JCS-1","sha256":"3ac3bf9e5c015582d31acd816f3be39e6d3835de8abb6e040460b6b9b4f492d8"},"publicPuzzleHash":{"profile":"STP-PUZZLE-SEMANTIC-JCS-1","sha256":"27c130c2740df8f04a136d1e0739ee9c1990131ad860ae268c41b9a7b7e2779c"},"puzzleId":"E1-7a9176132e207219951417ec176362109390aece4b155f4f9db727f877904465","solutionCount":1,"solutionHash":{"profile":"STP-SOLUTION-JCS-1","sha256":"5d0eff0c38d4e281e1e6a4e44b1e2f64667d8e66a6e63bdaca8073e37121f2b5"},"solverVersion":"solver-v2"}