{"metrics":{"deductionSteps":63,"maxDeductionDepth":8,"requiredGuessDepth":0,"searchNodes":0},"proofFormatVersion":1,"proofHash":{"profile":"STP-PROOF-JCS-1","sha256":"021f9c6f438ab6218500eee311d837e51dc420cca954d6889962ef9a85a0dec0"},"publicPuzzleHash":{"profile":"STP-PUZZLE-SEMANTIC-JCS-1","sha256":"9d0bc41aee7bec74bdc94cee1ce8fe43393ecf29158a1d28ae741d022f75f3be"},"puzzleId":"E1-bf9b2955aaf5cdee7ac70e8fd5afd5b40a371edb005aba481494d08640ec38f1","solutionCount":1,"solutionHash":{"profile":"STP-SOLUTION-JCS-1","sha256":"ee5b9acfce078124451dcc332171d367cfb62fde5a3a8a467ae8c0bd187b909f"},"solverVersion":"solver-v2"}