{"metrics":{"deductionSteps":39,"maxDeductionDepth":5,"requiredGuessDepth":0,"searchNodes":0},"proofFormatVersion":1,"proofHash":{"profile":"STP-PROOF-JCS-1","sha256":"5ee6d4e27d7afdfe1eec98dc2aedcf9628b1eecf9bc0e18fd2893492e49dfff1"},"publicPuzzleHash":{"profile":"STP-PUZZLE-SEMANTIC-JCS-1","sha256":"7fdacc6232198fed86885b719643a249510c3e5752d7f05fe813fd51707edd7c"},"puzzleId":"E1-491401afd74e82a692448049bdb983148d162fd7d3686d0ecdf7eaf97207336c","solutionCount":1,"solutionHash":{"profile":"STP-SOLUTION-JCS-1","sha256":"d06ef5cec4a48effa61f0dd837a7e026fca294f1008d0243e2487ebfeb576277"},"solverVersion":"solver-v2"}