{"metrics":{"deductionSteps":187,"maxDeductionDepth":20,"requiredGuessDepth":0,"searchNodes":0},"proofFormatVersion":1,"proofHash":{"profile":"STP-PROOF-JCS-1","sha256":"fa26f10e64e94b993ee6b598683ad5f806e179a4e74789e60cc0dcf8487d3607"},"publicPuzzleHash":{"profile":"STP-PUZZLE-SEMANTIC-JCS-1","sha256":"765f31eaf5261b37084972e7f2808c3c8935f37396004d838824f271779acd76"},"puzzleId":"E1-9f6549a8d6e48aa96eae32e56b00aeed11fd808b6d029a17eebfbc0b09e50ea6","solutionCount":1,"solutionHash":{"profile":"STP-SOLUTION-JCS-1","sha256":"ae547cb421b6da3cc63d00edb22d8e00bc0da2ac757b334bee0790f913eba07d"},"solverVersion":"solver-v2"}