{"metrics":{"deductionSteps":52,"maxDeductionDepth":8,"requiredGuessDepth":0,"searchNodes":0},"proofFormatVersion":1,"proofHash":{"profile":"STP-PROOF-JCS-1","sha256":"d41d40cd7a475699bab6350481752a67fbccc9000a9129eb4c1dda9eee693cfa"},"publicPuzzleHash":{"profile":"STP-PUZZLE-SEMANTIC-JCS-1","sha256":"71fe0822d17845ae3c60ade5b9ff7aeb5c897b4297c97ecb0e78520da2b26d80"},"puzzleId":"E1-b726bdb7e40a16ab1e4e6a5dba184b94db9243f97fd15057042c45e7bb658082","solutionCount":1,"solutionHash":{"profile":"STP-SOLUTION-JCS-1","sha256":"120b59dbb8dc7018270c247c1fc8e57ed5d03e834435007517cfed64b325beb9"},"solverVersion":"solver-v2"}