{"metrics":{"deductionSteps":132,"maxDeductionDepth":12,"requiredGuessDepth":0,"searchNodes":0},"proofFormatVersion":1,"proofHash":{"profile":"STP-PROOF-JCS-1","sha256":"c799afb13956f482eaeddfee4c5f006542033e884cd8205b9e9fcf91471e3935"},"publicPuzzleHash":{"profile":"STP-PUZZLE-SEMANTIC-JCS-1","sha256":"189ce48524ab21919ba51429b7d88558a4f4362e889a87926901a338f0c7f05c"},"puzzleId":"S1-04-04-05","solutionCount":1,"solutionHash":{"profile":"STP-SOLUTION-JCS-1","sha256":"132ee4685be4f76a0bfe5a9bd7e6f79def1a21e079ab6f22867e578423bc54a2"},"solverVersion":"solver-v2"}