{"metrics":{"deductionSteps":40,"maxDeductionDepth":5,"requiredGuessDepth":0,"searchNodes":0},"proofFormatVersion":1,"proofHash":{"profile":"STP-PROOF-JCS-1","sha256":"b7388799c04623ace15b686c57a65c791b1d1ca38feb1180fa67ff79169d229f"},"publicPuzzleHash":{"profile":"STP-PUZZLE-SEMANTIC-JCS-1","sha256":"cac81bfcbc83ed798c3e7e0a83163dbd94afe39e551ca62928a9681943f84e76"},"puzzleId":"E1-667be386babd6770c97e60082524964a7d01bc98a77e42972a38c55c58b2e729","solutionCount":1,"solutionHash":{"profile":"STP-SOLUTION-JCS-1","sha256":"b6beb44dd7ac4a9e40f56d947925f29e83e8efc573650a4cfcc4d8e8bacbef25"},"solverVersion":"solver-v2"}