{"metrics":{"deductionSteps":145,"maxDeductionDepth":11,"requiredGuessDepth":0,"searchNodes":0},"proofFormatVersion":1,"proofHash":{"profile":"STP-PROOF-JCS-1","sha256":"0ccaeedd5a58df20a3d243b100f0b7dab26c3c579275c536fa5967e207d3ec2a"},"publicPuzzleHash":{"profile":"STP-PUZZLE-SEMANTIC-JCS-1","sha256":"de98c9423d34ce46d77445b218ebb27d688bd8c0538dab49bfa9ee440f3e399c"},"puzzleId":"S1-05-02-03","solutionCount":1,"solutionHash":{"profile":"STP-SOLUTION-JCS-1","sha256":"2bae6bdadafdd80eeaf586b3709d128d9d287071099f95db04f079a7e7645b70"},"solverVersion":"solver-v2"}