{"metrics":{"deductionSteps":57,"maxDeductionDepth":6,"requiredGuessDepth":0,"searchNodes":0},"proofFormatVersion":1,"proofHash":{"profile":"STP-PROOF-JCS-1","sha256":"d3150ada5605c2c828ed9e2d5a1c074043e83be920c11a867944e144bc15a61a"},"publicPuzzleHash":{"profile":"STP-PUZZLE-SEMANTIC-JCS-1","sha256":"e0911642fdbf5c3e60f5369e3b45896c757fdcf08b0f1bff4c2c3cc31ed8c0b1"},"puzzleId":"E1-103f630f4e9ad9f45ccec2d84f71ac6d6a4594804cdcb4554f3382677b609ba0","solutionCount":1,"solutionHash":{"profile":"STP-SOLUTION-JCS-1","sha256":"721601ab4bf653ffd1cbff6ad1cee632180f967730df286c66ff1be072a99a54"},"solverVersion":"solver-v2"}