{"metrics":{"deductionSteps":144,"maxDeductionDepth":23,"requiredGuessDepth":0,"searchNodes":0},"proofFormatVersion":1,"proofHash":{"profile":"STP-PROOF-JCS-1","sha256":"0eea009e8095d28be003aca4c7d652370e71302d01875970e8773f4a1c4fe2cf"},"publicPuzzleHash":{"profile":"STP-PUZZLE-SEMANTIC-JCS-1","sha256":"8eaa83bdcf7ed69ad52074f379116fae4fbe709efb7d1829e1b96c3791810e0d"},"puzzleId":"E1-9dfb990ff20ef2ca934055461a84877b1ec9c71b0c424927fe60a0b7e5f701b6","solutionCount":1,"solutionHash":{"profile":"STP-SOLUTION-JCS-1","sha256":"328e76d11d423dc8601344c52e79e864d2bb71649acafa728db76e12806b067d"},"solverVersion":"solver-v2"}