{"metrics":{"deductionSteps":86,"maxDeductionDepth":9,"requiredGuessDepth":0,"searchNodes":0},"proofFormatVersion":1,"proofHash":{"profile":"STP-PROOF-JCS-1","sha256":"48ad95e16c6dc24cfeb5755f9db68fb3a676ef87097fae8fe5a0510dce850f08"},"publicPuzzleHash":{"profile":"STP-PUZZLE-SEMANTIC-JCS-1","sha256":"5491739aa0196cf856300eef82b7fd73c445880e5de8a03b0fbd4d470decaae5"},"puzzleId":"S1-03-03-03","solutionCount":1,"solutionHash":{"profile":"STP-SOLUTION-JCS-1","sha256":"26a24dfa0f1b733c98b45fd36bcea46d9d84f92f409f2237c44b4a5b98d9fc0e"},"solverVersion":"solver-v2"}