{"metrics":{"deductionSteps":57,"maxDeductionDepth":14,"requiredGuessDepth":0,"searchNodes":0},"proofFormatVersion":1,"proofHash":{"profile":"STP-PROOF-JCS-1","sha256":"f8ca0fe205e6a1f0bf553b146b62b46c06b71f58a44f04c0d2497361db9caafc"},"publicPuzzleHash":{"profile":"STP-PUZZLE-SEMANTIC-JCS-1","sha256":"cf354b1379504b21bbab3262b68df9fece4f637b4bbe1f720ec2a53c14cd4316"},"puzzleId":"S1-02-02-12","solutionCount":1,"solutionHash":{"profile":"STP-SOLUTION-JCS-1","sha256":"2d7b64f62d2ee2498acc5e0e2ff2cffac9b2f3911c48e2c3dc833999c48011ef"},"solverVersion":"solver-v2"}