{"metrics":{"deductionSteps":86,"maxDeductionDepth":10,"requiredGuessDepth":0,"searchNodes":0},"proofFormatVersion":1,"proofHash":{"profile":"STP-PROOF-JCS-1","sha256":"9efb39107f3486fe8290a4b35f3649d2f6005188f2d1bdc2e954bb2b1899c16b"},"publicPuzzleHash":{"profile":"STP-PUZZLE-SEMANTIC-JCS-1","sha256":"1b8b3865c26802555b64403a3c2cadbd49e22e5bf88940f18809b5dfbba3dbb5"},"puzzleId":"S1-03-03-04","solutionCount":1,"solutionHash":{"profile":"STP-SOLUTION-JCS-1","sha256":"154d7433efa2db5c67a1f76351e4a1b7b0ca4aec0360b48b1b70e8266c3e0054"},"solverVersion":"solver-v2"}