{"metrics":{"deductionSteps":96,"maxDeductionDepth":12,"requiredGuessDepth":0,"searchNodes":0},"proofFormatVersion":1,"proofHash":{"profile":"STP-PROOF-JCS-1","sha256":"e0023f7f09b3c6c351711b255cd322411e047cfb981458edad8c9191e00f0d5f"},"publicPuzzleHash":{"profile":"STP-PUZZLE-SEMANTIC-JCS-1","sha256":"d589b8d8224d60ff051bbd984c8126117525fcb1005385c626bd085b030cb119"},"puzzleId":"S1-03-03-10","solutionCount":1,"solutionHash":{"profile":"STP-SOLUTION-JCS-1","sha256":"e38c3736245dbb1212d263803c131ca1ee2ddb2b7429c9086a00aa18f50dfe03"},"solverVersion":"solver-v2"}