{"metrics":{"deductionSteps":85,"maxDeductionDepth":11,"requiredGuessDepth":0,"searchNodes":0},"proofFormatVersion":1,"proofHash":{"profile":"STP-PROOF-JCS-1","sha256":"102b1d8b546d1db58cec1e1303a9af3371f42ffe2506e6e353027cc4f712b9ca"},"publicPuzzleHash":{"profile":"STP-PUZZLE-SEMANTIC-JCS-1","sha256":"0595b2ad409df97ac923351b1ed005c1d7b832c39deb8952243e9af1ce1b0580"},"puzzleId":"S1-03-01-06","solutionCount":1,"solutionHash":{"profile":"STP-SOLUTION-JCS-1","sha256":"22de838ebdb04923d302d456038088f3895f36333df1eeedb7818f3c1b4eca9d"},"solverVersion":"solver-v2"}